{
  "version": 2,
  "cores": [
    {
      "id": "test_producer",
      "inputs": [
        {
          "name": "input_1",
          "metadata": {
            "type": "float",
            "width": 32,
            "signed": false,
            "common_io": false
          },
          "is_vector": false,
          "vector_size": 1,
          "source": {
            "type":"series",
            "value": [15.7,67.4]
          },
          "channel": 0
        },
        {
          "name": "input_2",
          "metadata": {
            "type": "float",
            "width": 32,
            "signed": false,
            "common_io": false
          },
          "is_vector": false,
          "vector_size": 1,
          "source": {
            "type":"series",
            "value":[42.92, -5.8]
          },
          "channel": 0
        }
      ],
      "order": 0,
      "outputs": [
      ],
      "program":{
        "content": "void main(){float input_1,input_2; float c = input_1 + input_2; float producer_out = producer_out + c;}",
        "build_settings": {
          "io": {
            "inputs": [
              "input_1",
              "input_2"
            ],
            "outputs": [
            ],
            "memories": [
              "producer_out"
            ]
          }
        },
        "headers": []
      },
      "memory_init": [
        {
          "name": "producer_out",
          "metadata": {
            "type": "float",
            "width": 32,
            "signed": false,
            "common_io": false
          },
          "is_vector": false,
          "vector_size": 1,
          "is_output": true,
          "reg_n": 4,
          "value": 0
        }
      ],
      "options":{
        "comparators":"reducing",
        "efi_implementation":"efi_sort"
      },
      "channels":1,
      "sampling_frequency": 1,
      "deployment": {
        "has_reciprocal": false,
        "control_address": 18316525568,
        "rom_address": 17179869184
      }
    },
    {
      "id": "test_consumer",
      "inputs": [],
      "memory_init": [],
      "input_data": [],
      "outputs": [
        {
          "metadata": {
            "type": "integer",
            "width": 32,
            "signed": true,
            "common_io": false
          },
          "is_vector": false,
          "vector_size": 1,
          "name":"consumer_out"
        }
      ],
      "order": 1,
      "program":{
        "content": "void main(){float input_1; float consumer_out = input_1;}",
        "build_settings": {
          "io": {
            "inputs": [
              "input_1"
            ],
            "outputs": [
              "consumer_out"
            ],
            "memories": [
            ]
          }
        },
        "headers": []
      },
      "options":{
        "comparators":"reducing",
        "efi_implementation":"efi_sort"
      },
      "channels":1,
      "sampling_frequency": 1,
      "deployment": {
        "has_reciprocal": false,
        "control_address": 18316525568,
        "rom_address": 17179869184
      }
    }
  ],
  "interconnect":[
    {
      "source":"test_producer",
      "destination":"test_consumer",
      "ports":[
        {
          "source": "test_producer.test_out",
          "destination": "test_consumer.input_1"
        }
      ]
    }
  ],
  "emulation_time": 2,
  "deployment_mode": false
}

