{
  "version": 2,
  "cores": [
    {
      "id": "test",
      "inputs": [
        {
          "name": "input_1",
          "metadata": {
            "type": "float",
            "width": 32,
            "signed": false,
            "common_io": false
          },
          "source": {
            "type":"series",
            "value": [15.7, 67.4]
          }
        }
      ],
      "outputs": [
        {
          "type": "float",
          "metadata": {
            "type": "float",
            "width": 32,
            "signed": false
          },
          "name":"out"
        }
      ],
      "memory_init": [],
      "program":{
        "content": "int main(){float input_1; float mem; float out; mem = mem + input_1; out = mem;}",
        "build_settings": {
          "io": {
            "inputs": [
              "input_1"
            ],
            "memories": [
              "mem"
            ],
            "outputs": [
              "out"
            ]
          }
        },
        "headers": []
      },
      "order": 1,
      "options":{
        "comparators":"reducing",
        "efi_implementation":"efi_sort"
      },
      "channels":1,
      "sampling_frequency": 1,
      "deployment": {
        "has_reciprocal": false,
        "control_address": 18316525568,
        "rom_address": 17179869184
      }
    }
  ],
  "interconnect": [],
  "emulation_time": 2,
  "deployment_mode": false
}